{"eligibleMaintainers":[],"officialRepository":"torjan0/cirewind","policyVersion":"v0.2-review-policy-1","profiles":[{"minimumMaintainers":2,"minimumOutsideReviewers":1,"profileId":"standard-v0.2","requiredAnyApprovalScopes":["hostile-input-privacy","identity"],"requiredOutsideScopes":[]},{"minimumMaintainers":2,"minimumOutsideReviewers":2,"profileId":"trivy-v0.2","requiredAnyApprovalScopes":["hostile-input-privacy","identity"],"requiredOutsideScopes":["component-namespace","ioc-extraction","time"]}],"schemaVersion":"cirewind.review-policy/v1alpha1"}
